[
  {
    "id": "default-dark",
    "name": "Vauchi Dark",
    "version": "2.0.0",
    "author": "Vauchi",
    "license": "MIT",
    "mode": "dark",
    "primitives": {
      "base": "#1a1a2e",
      "surface": "#16213e",
      "overlay": "#0f3460",
      "text": "#eeeeee",
      "subtext": "#a0a0a0",
      "blue": "#4fc3f7",
      "sapphire": "#0288d1",
      "green": "#4caf50",
      "red": "#f2b8b5",
      "peach": "#ff9800",
      "border-gray": "#333333",
      "ui-surface": "#222236",
      "ui-input": "#27273a",
      "ui-elevated": "#2f2f41",
      "ui-label": "#d7d7d7",
      "ui-muted": "#909092",
      "ui-teal": "#2dd4bf",
      "ui-tint-accent": "#22334c",
      "ui-tint-selected": "#1f2940",
      "ui-tint-teal": "#1d3644",
      "ui-tint-orange": "#3c2d27",
      "ui-tint-danger": "#3b202f",
      "ui-tint-green": "#223033",
      "ui-scrim": "#00000080",
      "ui-on-accent": "#0A0A0A",
      "ui-status-text-success": "#4caf50",
      "ui-status-text-warning": "#ff9800",
      "ui-status-text-error": "#f2b8b5",
      "ui-status-text-info": "#4fc3f7"
    },
    "semantic": {
      "bg-primary": "{base}",
      "bg-secondary": "{surface}",
      "bg-tertiary": "{overlay}",
      "text-primary": "{text}",
      "text-secondary": "{subtext}",
      "accent": "{blue}",
      "accent-dark": "{sapphire}",
      "success": "{green}",
      "error": "{red}",
      "warning": "{peach}",
      "border": "{border-gray}",
      "surface": "{ui-surface}",
      "surface-input": "{ui-input}",
      "surface-muted": "{overlay}",
      "bottombar-bg": "{surface}",
      "surface-elevated": "{ui-elevated}",
      "text-label": "{ui-label}",
      "text-muted": "{ui-muted}",
      "accent-bright": "{blue}",
      "icon-accent": "{blue}",
      "teal": "{ui-teal}",
      "tint-accent": "{ui-tint-accent}",
      "tint-selected": "{ui-tint-selected}",
      "tint-teal": "{ui-tint-teal}",
      "tint-orange": "{ui-tint-orange}",
      "tint-danger": "{ui-tint-danger}",
      "tint-green": "{ui-tint-green}",
      "scrim": "{ui-scrim}",
      "text-on-accent": "{ui-on-accent}",
      "focus-ring": "{blue}",
      "status-text-success": "{ui-status-text-success}",
      "status-text-warning": "{ui-status-text-warning}",
      "status-text-error": "{ui-status-text-error}",
      "status-text-info": "{ui-status-text-info}"
    }
  },
  {
    "id": "default-light",
    "name": "Vauchi Light",
    "version": "2.0.0",
    "author": "Vauchi",
    "license": "MIT",
    "mode": "light",
    "primitives": {
      "base": "#ffffff",
      "surface": "#f5f5f5",
      "overlay": "#e0e0e0",
      "text": "#212121",
      "subtext": "#757575",
      "blue": "#1976d2",
      "sapphire": "#0d47a1",
      "green": "#388e3c",
      "red": "#b3261e",
      "peach": "#f57c00",
      "border-gray": "#e0e0e0",
      "ui-surface": "#f6f6f6",
      "ui-input": "#f2f2f2",
      "ui-elevated": "#ffffff",
      "ui-label": "#3a3a3a",
      "ui-muted": "#868686",
      "ui-teal": "#16a79e",
      "ui-tint-accent": "#dceaf8",
      "ui-tint-selected": "#eaf3fb",
      "ui-tint-teal": "#dcf2f0",
      "ui-tint-orange": "#feebd9",
      "ui-tint-danger": "#f8e0e0",
      "ui-tint-green": "#e1eee2",
      "ui-scrim": "#00000080",
      "ui-on-accent": "#FFFFFF",
      "ui-status-text-success": "#2f7732",
      "ui-status-text-warning": "#a75500",
      "ui-status-text-error": "#b3261e",
      "ui-status-text-info": "#1668ba"
    },
    "semantic": {
      "bg-primary": "{base}",
      "bg-secondary": "{surface}",
      "bg-tertiary": "{overlay}",
      "text-primary": "{text}",
      "text-secondary": "{subtext}",
      "accent": "{blue}",
      "accent-dark": "{sapphire}",
      "success": "{green}",
      "error": "{red}",
      "warning": "{peach}",
      "border": "{border-gray}",
      "surface": "{ui-surface}",
      "surface-input": "{ui-input}",
      "surface-muted": "{overlay}",
      "bottombar-bg": "{surface}",
      "surface-elevated": "{ui-elevated}",
      "text-label": "{ui-label}",
      "text-muted": "{ui-muted}",
      "accent-bright": "{blue}",
      "icon-accent": "{blue}",
      "teal": "{ui-teal}",
      "tint-accent": "{ui-tint-accent}",
      "tint-selected": "{ui-tint-selected}",
      "tint-teal": "{ui-tint-teal}",
      "tint-orange": "{ui-tint-orange}",
      "tint-danger": "{ui-tint-danger}",
      "tint-green": "{ui-tint-green}",
      "scrim": "{ui-scrim}",
      "text-on-accent": "{ui-on-accent}",
      "focus-ring": "{blue}",
      "status-text-success": "{ui-status-text-success}",
      "status-text-warning": "{ui-status-text-warning}",
      "status-text-error": "{ui-status-text-error}",
      "status-text-info": "{ui-status-text-info}"
    }
  },
  {
    "id": "catppuccin-mocha",
    "name": "Catppuccin Mocha",
    "version": "2.0.0",
    "author": "Catppuccin",
    "license": "MIT",
    "source": "https://github.com/catppuccin/catppuccin",
    "mode": "dark",
    "primitives": {
      "base": "#1e1e2e",
      "mantle": "#181825",
      "surface0": "#313244",
      "text": "#cdd6f4",
      "subtext0": "#a6adc8",
      "blue": "#89b4fa",
      "sapphire": "#74c7ec",
      "green": "#a6e3a1",
      "red": "#f38ba8",
      "peach": "#fab387",
      "overlay0": "#45475a",
      "ui-surface": "#252536",
      "ui-input": "#28293a",
      "ui-elevated": "#303042",
      "ui-label": "#c1cae7",
      "ui-muted": "#969cb6",
      "ui-teal": "#2dd4bf",
      "ui-tint-accent": "#2e344d",
      "ui-tint-selected": "#282c40",
      "ui-tint-teal": "#203944",
      "ui-tint-orange": "#3f343b",
      "ui-tint-danger": "#3e2e40",
      "ui-tint-green": "#323c3f",
      "ui-scrim": "#00000080",
      "ui-on-accent": "#0A0A0A",
      "ui-status-text-success": "#a6e3a1",
      "ui-status-text-warning": "#fab387",
      "ui-status-text-error": "#f38ba8",
      "ui-status-text-info": "#89b4fa"
    },
    "semantic": {
      "bg-primary": "{base}",
      "bg-secondary": "{mantle}",
      "bg-tertiary": "{surface0}",
      "text-primary": "{text}",
      "text-secondary": "{subtext0}",
      "accent": "{blue}",
      "accent-dark": "{sapphire}",
      "success": "{green}",
      "error": "{red}",
      "warning": "{peach}",
      "border": "{overlay0}",
      "surface": "{ui-surface}",
      "surface-input": "{ui-input}",
      "surface-muted": "{surface0}",
      "bottombar-bg": "{mantle}",
      "surface-elevated": "{ui-elevated}",
      "text-label": "{ui-label}",
      "text-muted": "{ui-muted}",
      "accent-bright": "{blue}",
      "icon-accent": "{blue}",
      "teal": "{ui-teal}",
      "tint-accent": "{ui-tint-accent}",
      "tint-selected": "{ui-tint-selected}",
      "tint-teal": "{ui-tint-teal}",
      "tint-orange": "{ui-tint-orange}",
      "tint-danger": "{ui-tint-danger}",
      "tint-green": "{ui-tint-green}",
      "scrim": "{ui-scrim}",
      "text-on-accent": "{ui-on-accent}",
      "focus-ring": "{blue}",
      "status-text-success": "{ui-status-text-success}",
      "status-text-warning": "{ui-status-text-warning}",
      "status-text-error": "{ui-status-text-error}",
      "status-text-info": "{ui-status-text-info}"
    }
  },
  {
    "id": "catppuccin-latte",
    "name": "Catppuccin Latte",
    "version": "2.0.0",
    "author": "Catppuccin",
    "license": "MIT",
    "source": "https://github.com/catppuccin/catppuccin",
    "mode": "light",
    "primitives": {
      "base": "#eff1f5",
      "mantle": "#e6e9ef",
      "surface0": "#ccd0da",
      "text": "#4c4f69",
      "subtext0": "#6a6d82",
      "blue": "#1e66f5",
      "sapphire": "#209fb5",
      "green": "#40a02b",
      "red": "#d20f39",
      "peach": "#fe640b",
      "overlay0": "#9ca0b0",
      "ui-surface": "#e8ebef",
      "ui-input": "#e5e7ed",
      "ui-elevated": "#f9f9fb",
      "ui-label": "#555870",
      "ui-muted": "#7a7d90",
      "ui-teal": "#16a79e",
      "ui-tint-accent": "#d0dcf5",
      "ui-tint-selected": "#dce4f5",
      "ui-tint-teal": "#cee6e8",
      "ui-tint-orange": "#f1dcd2",
      "ui-tint-danger": "#ebcfd9",
      "ui-tint-green": "#d5e5d7",
      "ui-scrim": "#00000080",
      "ui-on-accent": "#FFFFFF",
      "ui-status-text-success": "#2d711e",
      "ui-status-text-warning": "#a84207",
      "ui-status-text-error": "#b80d32",
      "ui-status-text-info": "#1a57d0"
    },
    "semantic": {
      "bg-primary": "{base}",
      "bg-secondary": "{mantle}",
      "bg-tertiary": "{surface0}",
      "text-primary": "{text}",
      "text-secondary": "{subtext0}",
      "accent": "{blue}",
      "accent-dark": "{sapphire}",
      "success": "{green}",
      "error": "{red}",
      "warning": "{peach}",
      "border": "{overlay0}",
      "surface": "{ui-surface}",
      "surface-input": "{ui-input}",
      "surface-muted": "{surface0}",
      "bottombar-bg": "{mantle}",
      "surface-elevated": "{ui-elevated}",
      "text-label": "{ui-label}",
      "text-muted": "{ui-muted}",
      "accent-bright": "{blue}",
      "icon-accent": "{blue}",
      "teal": "{ui-teal}",
      "tint-accent": "{ui-tint-accent}",
      "tint-selected": "{ui-tint-selected}",
      "tint-teal": "{ui-tint-teal}",
      "tint-orange": "{ui-tint-orange}",
      "tint-danger": "{ui-tint-danger}",
      "tint-green": "{ui-tint-green}",
      "scrim": "{ui-scrim}",
      "text-on-accent": "{ui-on-accent}",
      "focus-ring": "{blue}",
      "status-text-success": "{ui-status-text-success}",
      "status-text-warning": "{ui-status-text-warning}",
      "status-text-error": "{ui-status-text-error}",
      "status-text-info": "{ui-status-text-info}"
    }
  },
  {
    "id": "catppuccin-frappe",
    "name": "Catppuccin Frappé",
    "version": "2.0.0",
    "author": "Catppuccin",
    "license": "MIT",
    "source": "https://github.com/catppuccin/catppuccin",
    "mode": "dark",
    "primitives": {
      "base": "#303446",
      "mantle": "#292c3c",
      "surface0": "#414559",
      "text": "#c6d0f5",
      "subtext0": "#a5adce",
      "blue": "#8caaee",